id,title,avatar,rating,snippet,likes,date,iso_date,response
8547bb4e-5ba6-4e2e-98d3-47f7b1119e07,Christopher Bladek,https://play-lh.googleusercontent.com/a/ACg8ocJbr68FoakzluorBl5vZ9buSLoCwdG5LJQwi35AwCL0eHRcIw=mo,3.0,"It's interesting. Some of it works pretty well, some of it is pretty frustrating and also impossible to navigate: for instance, the language games. They're ALL in Mandarin w/ no option to change this anywhere. My daughter doesn't have any background in Mandarin, and the games require a basic understanding of the language. I may update with more areas that could stand to be improved upon. It's a neat concept. Just wish it was better executed. And, as someone else commented, it is sluggish - even on our fairly decent tablet.",205,"July 15, 2021",2021-07-15T10:37:47Z,"{'title': 'EDOKI ACADEMY', 'snippet': ""Hello and thank you for your feedback, we're sorry to hear that the app is sluggish on your device, we are working on improving its performance on all devices. We've noted your comments on the language games too. Don't hesitate to contact our client support on support@edokiacademy.com"", 'date': 'July 19, 2021', 'iso_date': '2021-07-19T05:04:49Z'}"
1cccad67-9afc-4f50-a741-da694cf6d9d5,Valery Clark,https://play-lh.googleusercontent.com/a/ACg8ocJA_fA8Rsk8fjpQkrHT5npiCjyw62XJMqnooexOOk_2_txNoQ=mo,5.0,"I am absolutely beside myself! I cannot begin to describe how much I love this app! I played with the trial version for about 6 months to make sure it was what I was looking for. I have been using the paid service for about 5 months with 2 students. I did have some reservations about some holiday content, but there is a setting to turn those off. This is truly a montessori at home experience. I have also found some of the math material to be helpful for my older kids. I love, love, LOVE it!",98,"December 20, 2021",2021-12-20T19:13:38Z,
da4c86e8-57a1-4491-8fa5-785dfbb2c53f,Austin Hill,https://play-lh.googleusercontent.com/a/ACg8ocIhBcCJ3UFqKBT1ztSH_dlKXIF9_pRNeCX96lYc9tZT7A4xOg=mo,1.0,Pretty much everything you click on says subscribe for $10 a month. The main page has a big subscribe button. Everywhere you go there's a subscribe button on the page and it's in you face. Every area is locked except for a few here and there where you can do the first 1 or 2 levels. Not something my 3 year old likes.,65,"July 12, 2023",2023-07-12T05:15:43Z,"{'title': 'EDOKI ACADEMY', 'snippet': 'Hello, there are 12 games that are completely free, and we offer a 1-week free trial for you to make up your mind. Contact our team for more information: support@edokiacademy.com', 'date': 'July 10, 2023', 'iso_date': '2023-07-10T17:13:09Z'}"
633f5719-5a17-4c70-8488-c99be8dd7029,Mau,https://play-lh.googleusercontent.com/a-/ALV-UjWQ0ql5QXYfr_3UjmrA1ThTA6UCA_3Nih-h8mrP9r54KhMwD5ylgQ,1.0,"The app doesn't open, at the start freeze and never load to use it on google pixel 9 pro.",1,"September 18, 2024",2024-09-18T18:42:54Z,"{'title': 'EDOKI ACADEMY', 'snippet': 'Hello, we are sorry to hear that you have trouble with opening our app. Could you please contact the support at support@edokiacademy.com so they can help you resolve this matter.', 'date': 'September 19, 2024', 'iso_date': '2024-09-19T04:53:16Z'}"
172f2e04-59e1-4d1e-9825-0200fea0b529,A Google user,https://play-lh.googleusercontent.com/EGemoI2NTXmTsBVtJqk8jxF9rh8ApRWfsIMQSt2uE4OcpQqbFu7f7NbTK05lx80nuSijCz7sc3a277R67g,5.0,"I tried the 7 day trial, and the app is well constructed with a lot of diversity (very well made to help children move forwards educationally). The cost at the moment isn't something I can afford, and I mistakenly unsubscribed too late (which at first caused my account to be billed), but I was able to resolve the problem with the customer service representatives (they were very quick in responding, and addressed the situation appropriately). I highly recommend the app and the company.",77,"November 27, 2019",2019-11-27T16:23:32Z,
585348d1-618c-4845-a23f-270693251f4f,A Google user,https://play-lh.googleusercontent.com/EGemoI2NTXmTsBVtJqk8jxF9rh8ApRWfsIMQSt2uE4OcpQqbFu7f7NbTK05lx80nuSijCz7sc3a277R67g,5.0,"this is a wonderful app, quite expensive but totally worth it my child loves it, i have changed my starnrsting up and down over time as had some problem tith the app size stopping acccess - technical difficilties that the support team were initially slow in resolving - however, they then came back and persevered to fix the problem- as you would hope to see for an expensive app like this. It is totally worth it for the quality and variety of interactive and educational games, some lovely touches.",87,"February 18, 2019",2019-02-18T15:41:22Z,
fca90fbe-23f8-4125-91fc-37738a1d515b,Javis Li,https://play-lh.googleusercontent.com/a/ACg8ocJBV0_PoGfWpVwjeCXZLXTUXWqBdNJRFUE8yzpAb7ZllLz4cQ=mo,2.0,"Hi I tried the free version on iPad and it worked well. However when I wanted to downloaded it on a Samsung tablet, I couldn't get through I chose yearly subscription, it asked me to enter the birth year, I tried and my son, both didn't work. I clicked the cross and it kept loading However when I tried to add another kid and entered my birth year, it's ok. Please let me know how it can be fixed as I want to subscribe it when it's half price.",8,"August 18, 2020",2020-08-18T09:10:35Z,"{'title': 'EDOKI ACADEMY', 'snippet': ""Hello, We are going to help. We've answered directly on your email address. Best,"", 'date': 'August 20, 2020', 'iso_date': '2020-08-20T12:02:49Z'}"
e7c595a0-d60e-4402-be56-ebe3c1bb4f43,A Google user,https://play-lh.googleusercontent.com/EGemoI2NTXmTsBVtJqk8jxF9rh8ApRWfsIMQSt2uE4OcpQqbFu7f7NbTK05lx80nuSijCz7sc3a277R67g,3.0,"So much potential! Love the activities in this app. I purchased it, so should have access to it all however certain parts don't work. Right now the beehive activity isn't working, the calendar wasn't working earlier. It fluctuates and disappointed my toddler when he get his special time to ""play"" on this app. Also it gets really slow and glitchy and I am using a brand new device that is updated. So a little disappointment, but wish it would always work!!",75,"January 17, 2020",2020-01-17T19:29:09Z,
581b2541-9f80-46d5-9c5f-b97f4f822a9d,A Google user,https://play-lh.googleusercontent.com/EGemoI2NTXmTsBVtJqk8jxF9rh8ApRWfsIMQSt2uE4OcpQqbFu7f7NbTK05lx80nuSijCz7sc3a277R67g,5.0,"We homeschool and my son (just turned 6) is so dang brilliant! Sometimes, however, certain things do not hold his interest. Reading is one of those things. We’ve tried different curriculum, workbooks, other apps, flashcards, reading books, youtube videos... nothing held his attention (and other apps left him wandering around the page without actually working on the educational part of it). The Kindergarten Montessori is the only app that has held his attention. It’s also the only app that is MAKI",9,"August 14, 2019",2019-08-14T15:58:32Z,
e4b4fae1-12d2-4ea6-b6ae-7890c77d7fae,A Google user,https://play-lh.googleusercontent.com/EGemoI2NTXmTsBVtJqk8jxF9rh8ApRWfsIMQSt2uE4OcpQqbFu7f7NbTK05lx80nuSijCz7sc3a277R67g,5.0,"I like it. My kids love it and it's educational. My two-year-old daughter will be playing it and also giving them access to all kinds of rhymes. I love that they make it fun and there are mini-games after fully completing a puzzle. This Montessori app is wonderful, particularly for times with the little one needs to be quiet. Thank you!",8,"May 12, 2019",2019-05-12T12:12:30Z,
b22bf33e-d452-4521-86b9-b9e83a2fd3b8,A Google user,https://play-lh.googleusercontent.com/EGemoI2NTXmTsBVtJqk8jxF9rh8ApRWfsIMQSt2uE4OcpQqbFu7f7NbTK05lx80nuSijCz7sc3a277R67g,5.0,"We work with our three-year-old daily on various learning activities, and she’s doing well! However, I feel this app is a powerful learning tool that has helped round out her recognition of letters and various concepts. Playing preschool games is just so much fun and I am so happy she loves it. It keeps her focused in a way that our lessons sometimes don’t. I highly recommend it!",15,"August 24, 2019",2019-08-24T08:54:53Z,
995b3a03-1d16-49a3-ac11-36cefb8a6659,Drummond Richardson,https://play-lh.googleusercontent.com/a-/ALV-UjV_gNSs7kI_cdA48PNtIP4b06HLc39-WAC2DcWP_dv2hezDHvJRpw,5.0,"Interesting unusual and varied activities to teach lots of concepts. My almost 4yr daughter has been enjoying it very much, and we can do activities together or by herself. Seems to me that the interface is cleverly made to be both intuitive and stretches the dexterity of a child. My impression is that it focuses on the learning of the child as opposed to looking nice. Simple effective design.",130,"May 29, 2020",2020-05-29T14:20:25Z,
78956f51-15d9-44f7-9acf-8241611b2b41,A Google user,https://play-lh.googleusercontent.com/EGemoI2NTXmTsBVtJqk8jxF9rh8ApRWfsIMQSt2uE4OcpQqbFu7f7NbTK05lx80nuSijCz7sc3a277R67g,5.0,"My son’s teacher recommended I download The Kindergarten Montessori to help him with his reading as he was having some trouble. We’ve been using it for months and he is really improving! He’s starting to become such a confident reader, I can’t recommend this program enough. Loves the game way of learning, preschool games are fun, really helpful.",3,"August 19, 2019",2019-08-19T16:51:06Z,
90932a83-3de3-4ac5-bb6d-1e47016e0311,A Google user,https://play-lh.googleusercontent.com/EGemoI2NTXmTsBVtJqk8jxF9rh8ApRWfsIMQSt2uE4OcpQqbFu7f7NbTK05lx80nuSijCz7sc3a277R67g,5.0,"We homeschool and my son (just turned 6) is so dang brilliant! Sometimes, however, certain things do not hold his interest. Reading is one of those things. We’ve tried different curriculum, workbooks, other apps, flashcards, reading books, youtube videos... nothing held his attention (and other apps left him wandering around the page without actually working on the educational part of it). The Kindergarten Montessori is the only app that has held his attention. It’s also the only app that is MAKI",13,"August 20, 2019",2019-08-20T16:59:14Z,
17b92d21-4059-4831-b9fb-bb439186dd21,A Google user,https://play-lh.googleusercontent.com/EGemoI2NTXmTsBVtJqk8jxF9rh8ApRWfsIMQSt2uE4OcpQqbFu7f7NbTK05lx80nuSijCz7sc3a277R67g,5.0,"My child loved the app from the first time I gave it to them. I really appreciated how it was truly personalized to my child and the lessons are really engaging and thoughtful, the app is totally fun, there are fun-filled preschool games which helps them learn along the way. Most learning apps are full of tricks to win prizes to dress up your character, this one is built around the fun of learning.",12,"August 16, 2019",2019-08-16T17:11:22Z,
49be7b3f-86fa-4009-95f9-44a559f72b1b,A Google user,https://play-lh.googleusercontent.com/EGemoI2NTXmTsBVtJqk8jxF9rh8ApRWfsIMQSt2uE4OcpQqbFu7f7NbTK05lx80nuSijCz7sc3a277R67g,5.0,"I’m a lab elementary teacher and I was looking for some apps that would help get my children off on the right foot for reading! They did enjoy the app, however, my daughter became bored quickly with the sight words part of the game. They enjoyed the different songs, books, preschool games, etc.,",2,"August 07, 2019",2019-08-07T12:56:34Z,
d0d9122e-a8b0-417f-b745-71794e10b9a8,Daniel Garcia Rodriguez,https://play-lh.googleusercontent.com/a-/ALV-UjUNg51A4RqtkQ5g_4QtJHdjWkrV99yaZJ1sLY4VuqP9ac8BGrhuuA,4.0,"Slow loading, but great content, worth paying. I just wished there was a Windows 10 version, because running through bluestacks is not ideal, and don't really wanna buy another tablet just for it. Performance issues should also be mostly gone on regular PCs.",109,"April 30, 2020",2020-04-30T11:40:49Z,"{'title': 'EDOKI ACADEMY', 'snippet': ""Bonjour et merci nous sommes heureux que vous appréciez notre contenu. Nous travaillons pour améliorer nos applications. N'hésitez pas à nous écrire sur support@edokiacademy.com pour nous donner plus de détails."", 'date': 'May 01, 2020', 'iso_date': '2020-05-01T12:17:47Z'}"
9c9b21a9-c126-4310-bde8-9446cdfdf5bf,A Google user,https://play-lh.googleusercontent.com/EGemoI2NTXmTsBVtJqk8jxF9rh8ApRWfsIMQSt2uE4OcpQqbFu7f7NbTK05lx80nuSijCz7sc3a277R67g,5.0,"This app is fantastic my son. Loves having options to play with different portions and skills. The ability to use it offline makes it even better, our trip on an airplane was made easier and every time my son turns on airplane mode it doesn't matter.",4,"March 23, 2020",2020-03-23T12:44:40Z,
0879812d-5c2f-411e-83a4-0d49b8e09244,A Google user,https://play-lh.googleusercontent.com/EGemoI2NTXmTsBVtJqk8jxF9rh8ApRWfsIMQSt2uE4OcpQqbFu7f7NbTK05lx80nuSijCz7sc3a277R67g,1.0,"Terrible customer service and don't bother to download unless you're NEVER, EVER going to need to change phones. Paid for a year and got two months of use because I switched from iphone to android. Contacted Edoki several times and their solutions never worked (also no INTERACTIVE way to contact them). You have to do a deep dive in their help pages to get a contact, then once you email and they answer, that's it. If you want to communicate more, you have to start over. No phone number. Nada. Go with another learning app. The two months I did have this, it got kinda stale. Reply to reply: ""Instantly"" is a bit of a stretch, and you asked which account email address to restore. I sent my reply, and a day into all this still don't have resolution (an accessible paid in full account). Despite their BS about having gotten my messages, now 03/22 and still no access. Contesting via credit card. Lowering star rating.",131,"March 23, 2020",2020-03-23T01:20:19Z,"{'title': 'EDOKI ACADEMY', 'snippet': ""Hello, we're so sorry that you are unhappy but we replied to all your messages and I gave you my phone number on Feb 20th. We're more than happy to help and solve your situation, we want children to be able to use our app."", 'date': 'March 21, 2020', 'iso_date': '2020-03-21T22:17:34Z'}"
076f6cfc-1090-4057-b689-5ea71dbb31ab,Jane Rose,https://play-lh.googleusercontent.com/a-/ALV-UjWoPUcwzQVoMoa7yHVkF4qft8ZPrP1d9AbTBrv-6tffFBaWpaEnvQ,1.0,Agree with another comment made down below.. Really dangerous to teach little ones to shake a whole pill bottle in to their mouth!! Thankfully I watch all the games my daughter plays. It's also really laggy when pressing (and it's not the tab we bought a really good one and it's the same on every thing we have the game on) when she touches the screen it's really 50/50 if it even registers she's pressed it or not. So unfortunate because this game has so much potential. Also graphics need work.,43,"October 04, 2021",2021-10-04T07:11:42Z,"{'title': 'EDOKI ACADEMY', 'snippet': 'Hello we’re sorry to hear that the app lags, it really shouldn’t as we considerably reduced the size to improve performance. Did you contact our help service - support@edokiacademy.com?', 'date': 'October 04, 2021', 'iso_date': '2021-10-04T12:58:37Z'}"
819e622c-e783-4a67-be4f-2f634d57a6d6,A Google user,https://play-lh.googleusercontent.com/EGemoI2NTXmTsBVtJqk8jxF9rh8ApRWfsIMQSt2uE4OcpQqbFu7f7NbTK05lx80nuSijCz7sc3a277R67g,5.0,"I downloaded and subscribed to Montessori with the hopes of getting my child interested in learning and reading at an early age and I couldn’t be happier with the result! With Montessori, my son (age 4) has his interests and passions turned into personalized lessons and levels that he adores. He loves preschool games, which is so much fun and makes them have fun while learning.",3,"August 12, 2019",2019-08-12T14:04:15Z,
8dfb7db2-47b8-4c19-95c8-07d37064ef9d,A Google user,https://play-lh.googleusercontent.com/EGemoI2NTXmTsBVtJqk8jxF9rh8ApRWfsIMQSt2uE4OcpQqbFu7f7NbTK05lx80nuSijCz7sc3a277R67g,5.0,My kid is only 3.5 and we read to him every night but I never really pushed him to sound things out or write on his own. Then he started playing around on this app and he’s SO INTO IT! He is starting to recognize “sight words” and tries spelling and sounding out words in our nighttime stories. Thank you so much for this app.,5,"August 12, 2019",2019-08-12T14:49:35Z,
c0208a7d-cce8-4e25-9b97-a1c37fd0da4e,Jaime Quigley,https://play-lh.googleusercontent.com/a-/ALV-UjWmbjTP3z_dFto4rsG_IzF9-VR7dEpjzhNxKX8HGp6AarFgFwo,1.0,"Trying to subscribe (because there's absolutely nothing worthwhile or ""Montessori"" that's offered without paying), but I can't because it keeps telling me I need to add a payment option to my DAUGHTER'S account. I signed on with MY email, even from my own phone, and her tablet's email comes up and there's no way to switch it.",11,"February 23, 2024",2024-02-23T18:42:31Z,"{'title': 'EDOKI ACADEMY', 'snippet': 'Hello, please contact our team on support@edokiacademy.com, they will help you', 'date': 'February 24, 2024', 'iso_date': '2024-02-24T00:43:36Z'}"
a3a59900-6465-4723-a15c-d575fd8abfbe,A Google user,https://play-lh.googleusercontent.com/EGemoI2NTXmTsBVtJqk8jxF9rh8ApRWfsIMQSt2uE4OcpQqbFu7f7NbTK05lx80nuSijCz7sc3a277R67g,2.0,"The company does not send an alert prior to charging, it charges annually (not monthly), and does not issue a refund unless you make a stink about it. DO NOT SIGN UP FOR THE 'TRIAL' UNLESS YOU'VE MADE YOUR OWN ALERT TO CANCEL **24 HOURS PRIOR TO** THE END-OF-TRIAL date! The company originally refused to issue a refund; it only agreed to the refund after I responded saying I would leave an appropriate review with a low score. The app may be worth it (my son didn't use it, so I don't know), but be SURE you want it if you sign up for the trial, or be very diligent about canceling",30,"November 27, 2019",2019-11-27T14:55:29Z,
f75e6e75-1ace-425f-8785-5b9955988138,A Google user,https://play-lh.googleusercontent.com/EGemoI2NTXmTsBVtJqk8jxF9rh8ApRWfsIMQSt2uE4OcpQqbFu7f7NbTK05lx80nuSijCz7sc3a277R67g,5.0,"Using the application is so simple so my boy can play it easily. He seems to love it so much, I think because there are many funny animations in this game. And the thing that I appreciate is the game can help my boy improve some new words and new concepts. So amazing.",3,"May 21, 2019",2019-05-21T15:11:02Z,
7dd72382-2399-4260-9b97-42dff8920150,A Google user,https://play-lh.googleusercontent.com/EGemoI2NTXmTsBVtJqk8jxF9rh8ApRWfsIMQSt2uE4OcpQqbFu7f7NbTK05lx80nuSijCz7sc3a277R67g,2.0,Seems nice but not for toddlers i guess even though it has games for them. This is a trial version and was not much free to even test. But my son didn't seem to like it so not buying it. Only able to access everything if you subscribe. And is pricey.,19,"August 24, 2019",2019-08-24T04:47:04Z,
f58d03ef-87a2-44db-9671-df65d28e02b4,Marcus,https://play-lh.googleusercontent.com/a/ACg8ocIzh1mnNGNOI_BZumuEVAJoLsPm720zqWRFelSla76AAlONRA=mo,3.0,"App is polished. However, some games are too easy for my 3 year old, some too difficult. I can't remove single games from from the menu, only topics. As I can't remove single games my child often chooses games of little value to him. The practical value of the app is this low.",21,"July 12, 2023",2023-07-12T05:36:28Z,"{'title': 'EDOKI ACADEMY', 'snippet': ""Hi Marcus, you can actually remove single games. Please contact our support team at support@edokiacademy.com and they will gladly help you if you don't know how to do it."", 'date': 'July 12, 2023', 'iso_date': '2023-07-12T18:33:28Z'}"
6b7c4920-9ab9-4e16-b4e3-948e025ed963,A Google user,https://play-lh.googleusercontent.com/EGemoI2NTXmTsBVtJqk8jxF9rh8ApRWfsIMQSt2uE4OcpQqbFu7f7NbTK05lx80nuSijCz7sc3a277R67g,5.0,My kids love playing and I’m totally okay letting them have this screen time. The preschool games change up so my kids don’t get bored. The program moves slowly enough for my preschooler and kindergartener to follow without getting frustrated but they progress fast enough I don’t feel like they are wasting time.,2,"August 24, 2019",2019-08-24T08:54:15Z,
e77f61e1-10b5-4405-b986-8c749fa2df72,Pascale Pinette,https://play-lh.googleusercontent.com/a-/ALV-UjX0aW8Kr3z498mNhuioSPPmblKKIe3MLMOjFjzzhPOpUmDwJeCfxQ,5.0,You can choose which activities to keep in the game so we use it mainly for chinese. Plenty of quality content. The reward system is great! There's a store for the child to buy things like t-shirts or toys or a train game where extra buildings/trees/etc. can be bought with the 'money' won.,21,"May 27, 2022",2022-05-27T12:09:39Z,
7a55afdd-9a13-4859-83e1-0c52f700fde4,A Google user,https://play-lh.googleusercontent.com/EGemoI2NTXmTsBVtJqk8jxF9rh8ApRWfsIMQSt2uE4OcpQqbFu7f7NbTK05lx80nuSijCz7sc3a277R67g,5.0,I was too stressed over sending my little one to preschool. I hated the idea of leaving her at the spot for a considerable length of time and afterward get her. I constantly needed to have an alternative like this.,1,"January 29, 2020",2020-01-29T14:42:21Z,
7419b4ed-8d7f-4cd2-8f83-8798e0dd8c1d,T J,https://play-lh.googleusercontent.com/a/ACg8ocIIu7-Ah3lrBByPmzbKxWUym_JIZl2wPig83rIw52wPQRPPRzc=mo,1.0,"My child enjoyed the free content so I decided to give it a try. The dang thing never downloaded. I tried freeing up space on my phone, leaving it on the download screen overnight and nothing. When I try to open the app the screen just says downloading. The free content was good, but that's just not good enough.",59,"July 13, 2020",2020-07-13T12:39:28Z,"{'title': 'EDOKI ACADEMY', 'snippet': 'Hello, we are really sorry about that. We can help. If you want to, please contact us at support@edokiacademy.com and ask for Valérie.', 'date': 'July 13, 2020', 'iso_date': '2020-07-13T13:20:22Z'}"
d26ba7a9-4e62-40a8-9ebb-e2c781830316,A Google user,https://play-lh.googleusercontent.com/EGemoI2NTXmTsBVtJqk8jxF9rh8ApRWfsIMQSt2uE4OcpQqbFu7f7NbTK05lx80nuSijCz7sc3a277R67g,5.0,"This game is great for my son. My 3-year-old son. He loves this app. He learned many things while on this app. He learned to distinguish the colors, the shapes that various objects. Sound and pictures are so great, very lively. I find this a very good game to train my son thinking ability and thinking. He learned a lot of rhymes and everything. Thank so much for this app.",15,"May 31, 2019",2019-05-31T13:58:06Z,
5571ba89-cc1a-4399-9c0a-424fd7844477,Erica Max,https://play-lh.googleusercontent.com/a/ACg8ocLo9lEZGc2F_j4YflxFGjsufLaUVhfayrdqYMClm9Gg1jk7QA=mo,5.0,"This app is fantastic my son. Loves having options to play with different portions and skills. The ability to use it offline makes it even better, our trip on an airplane was made easier and every time my son turns on airplane mode it doesn't matter.",2,"June 03, 2020",2020-06-03T09:09:29Z,
51e82512-8b4e-4736-a14e-30282db0924a,Betty Antonio,https://play-lh.googleusercontent.com/a/ACg8ocL3PYqjY6FcbQVjbiU13sfpHne_Fnrvb21a8yIhed98ZBf_Xg=mo,5.0,"It's a great app, my daughter really enjoys it and supports many aspects of EYFS and beyond. You can set it in UK and US English. In addition, client support was very helpful when I contacted them. Well worth the investment.",1,"June 10, 2020",2020-06-10T07:38:54Z,
32ef5536-6b2c-4688-89a9-bbe1559a784c,A Google user,https://play-lh.googleusercontent.com/EGemoI2NTXmTsBVtJqk8jxF9rh8ApRWfsIMQSt2uE4OcpQqbFu7f7NbTK05lx80nuSijCz7sc3a277R67g,5.0,I love all their apps I've purchased so far. Both my 3 and 2-year-olds enjoy every minute. My 3-year-old even enjoys being able to help or teach her younger sister how to do the activities. Learning all around!,6,"May 13, 2019",2019-05-13T16:42:37Z,
a0f0dd6c-5ff8-4a1a-aad2-2ab0f511ad33,A Google user,https://play-lh.googleusercontent.com/EGemoI2NTXmTsBVtJqk8jxF9rh8ApRWfsIMQSt2uE4OcpQqbFu7f7NbTK05lx80nuSijCz7sc3a277R67g,1.0,"I was very excited to try the app because it's a Montessori one. I never use cc to even try any app but I was going to go this one because I was really interested. Unfortunately, the app doesn't let me go, I can't pass further than ""please submit your date of birth"" stage. I have tried and tried and nothing. So, I am disappointed. I will give 1 start for this issue. If by any chance you resolve the issue , please let me know. Thank you.",15,"April 26, 2020",2020-04-26T16:30:01Z,"{'title': 'EDOKI ACADEMY', 'snippet': 'Hello, you need to input your year of birth, not your child\'s, it is a ""parental gate"" to stop children from going to the payment page. Please write to Valérie, support@edokiacademy.com', 'date': 'April 27, 2020', 'iso_date': '2020-04-27T14:37:25Z'}"
ab6fef60-5291-46c8-997f-573cd039f633,A Google user,https://play-lh.googleusercontent.com/EGemoI2NTXmTsBVtJqk8jxF9rh8ApRWfsIMQSt2uE4OcpQqbFu7f7NbTK05lx80nuSijCz7sc3a277R67g,5.0,"My 4-year-old niece loves this app she isn’t allowed much screen time but whenever she is she’s always asking me for Montessori reading, it has various categories to select from in terms of child’s interests and needs which is amazing!! I would highly recommend this app to anyone with school-aged kids.",2,"August 26, 2019",2019-08-26T17:28:49Z,
780ae73b-174b-43fe-98d4-3c7ad2bf8958,A Google user,https://play-lh.googleusercontent.com/EGemoI2NTXmTsBVtJqk8jxF9rh8ApRWfsIMQSt2uE4OcpQqbFu7f7NbTK05lx80nuSijCz7sc3a277R67g,5.0,"This is the perfect app for my 5-year-old. It really emphasizes what he learns in school and helps build connections in fun interactive ways! Preschool games are the best, they teach and interactively help kids, Thanks a lot for this app.",2,"August 17, 2019",2019-08-17T15:19:01Z,
f3984867-307a-46bf-ac1f-112aa98db16b,Rob Paulson,https://play-lh.googleusercontent.com/a-/ALV-UjXJNRzJSbcjzFuLoZpI-Sc5W1Hkz_VNWh_NLGugiHyofccdZgkg,1.0,"Spent almost $60 on the annual subscription, now the app just says downloading after I open it. No error message, no indication of progress. Would not recommend. Now my kid is disappointed and I have to waste time figuring out how to get a refund.",39,"August 22, 2020",2020-08-22T16:53:08Z,"{'title': 'EDOKI ACADEMY', 'snippet': 'Hello, could you please contact us at support@edokiacademy.com we will help you.', 'date': 'August 23, 2020', 'iso_date': '2020-08-23T13:05:13Z'}"
